{
  "artifact": {
    "artifact_id": "CORE.CODEX.PhoenixSchema",
    "official_name": "CORE.CODEX.PhoenixSchema.md",
    "canonical_version": "v16.0",
    "legacy_version": "v14.0",
    "lifecycle_state": "ACTIVE",
    "canonization_state": "CANONIZED",
    "domain": "GVRN",
    "status_resolution": "The body-level v16.0 executable schema supersedes the v14.0 header. ACTIVE is treated as lifecycle availability; CANONIZED is treated as governance approval."
  },
  "poetic_layer": {
    "purpose": "Preserve the philosophical ethos of the Phoenix Schema while separating it from executable governance controls.",
    "domain_groups": [
      {
        "id": "identity-and-traceability",
        "name": "Identity and Traceability",
        "purpose": "Every artifact, event, and state transition must be identifiable, linked, and auditable.",
        "laws": [
          "LAW-002",
          "LAW-003",
          "LAW-004",
          "LAW-010",
          "LAW-017",
          "LAW-035",
          "LAW-042"
        ]
      },
      {
        "id": "resilience-and-remediation",
        "name": "Resilience and Remediation",
        "purpose": "Failure is expected, contained, logged, and converted into safer future behavior.",
        "laws": [
          "LAW-001",
          "LAW-011",
          "LAW-024",
          "LAW-026",
          "LAW-027",
          "LAW-030",
          "LAW-031"
        ]
      },
      {
        "id": "grounded-intelligence",
        "name": "Grounded Intelligence",
        "purpose": "Inference must be grounded, confidence-aware, and routed through explicit decision controls.",
        "laws": [
          "LAW-005",
          "LAW-006",
          "LAW-019",
          "LAW-020",
          "LAW-034",
          "LAW-036",
          "LAW-037",
          "LAW-041"
        ]
      },
      {
        "id": "policy-and-access",
        "name": "Policy and Access",
        "purpose": "Governance, access, and promotion are enforced through code rather than prose alone.",
        "laws": [
          "LAW-007",
          "LAW-013",
          "LAW-015",
          "LAW-022",
          "LAW-028"
        ]
      },
      {
        "id": "evolution-and-operations",
        "name": "Evolution and Operations",
        "purpose": "The system evolves through observable, automated, reviewable operational loops.",
        "laws": [
          "LAW-008",
          "LAW-009",
          "LAW-014",
          "LAW-016",
          "LAW-023",
          "LAW-032",
          "LAW-038",
          "LAW-039"
        ]
      },
      {
        "id": "experience-and-modularity",
        "name": "Experience and Modularity",
        "purpose": "User experience, modular boundaries, and symbolic feedback reflect system state without corrupting core governance.",
        "laws": [
          "LAW-012",
          "LAW-018",
          "LAW-021",
          "LAW-025",
          "LAW-029",
          "LAW-033",
          "LAW-040"
        ]
      }
    ]
  },
  "executable_contract": {
    "law_fields": [
      "id",
      "intent",
      "principle",
      "enforcement",
      "severity",
      "test",
      "owner",
      "dependencies",
      "validation_criteria"
    ],
    "laws": [
      {
        "id": "LAW-001",
        "domain": "resilience-and-remediation",
        "intent": "Friction creates Form; moving from static perfection to dynamic resilience.",
        "principle": "Chaos Engineering",
        "enforcement": "External API and internal module calls must use circuit breakers with fallback states.",
        "severity": "MUST",
        "test": "Inject controlled dependency failures and assert failure rate stays at or below 0.005 with fallback routing.",
        "owner": "Resilience Engineering",
        "dependencies": [
          "AOP-CERBERUS-002",
          "observability.metrics.failure_rate"
        ],
        "validation_criteria": [
          "Circuit breaker config exists for each external boundary.",
          "Fallback path is tested.",
          "Failure events are logged."
        ]
      },
      {
        "id": "LAW-002",
        "domain": "identity-and-traceability",
        "intent": "A name is the first thread in the weave of being; formal, indexable identity.",
        "principle": "Content-Addressable Storage",
        "enforcement": "Generated artifacts require a SHA-256 semantic content hash and a valid UIP vector signature.",
        "severity": "MUST",
        "test": "Reject artifact read/write requests missing content_hash or UIP signature.",
        "owner": "Governance Registry",
        "dependencies": [
          "UIP vector signature",
          "canonical_identity.rego"
        ],
        "validation_criteria": [
          "content_hash matches SHA-256 format.",
          "UIP signature is present.",
          "Hash changes when semantic content changes."
        ]
      },
      {
        "id": "LAW-003",
        "domain": "identity-and-traceability",
        "intent": "Truth exists in the superposition of possibilities until observed.",
        "principle": "Quantum Logic Gating",
        "enforcement": "Candidate seeds must remain gated until probabilistic spread falls below the consensus threshold; ungated promotion is prohibited.",
        "severity": "MUST",
        "test": "Submit three seed candidates and reject promotion when sigma is greater than or equal to 0.05.",
        "owner": "Consensus Engine",
        "dependencies": [
          "probabilistic_consensus.rego",
          "Superposition_Fault gating"
        ],
        "validation_criteria": [
          "At least three seeds are evaluated.",
          "Spread metric is computed.",
          "Unresolved superposition emits a gated fault.",
          "Promotion is denied while the gate is unresolved."
        ]
      },
      {
        "id": "LAW-004",
        "domain": "identity-and-traceability",
        "intent": "Knowledge does not exist until it is woven.",
        "principle": "Graph Topology",
        "enforcement": "New artifacts must contain at least one verified bidirectional graph pointer.",
        "severity": "MUST",
        "test": "Attempt to merge an orphan artifact and assert graph_connectivity denies it.",
        "owner": "Knowledge Graph",
        "dependencies": [
          "GUCA-LINK-001",
          "graph_connectivity.rego"
        ],
        "validation_criteria": [
          "Node degree is at least 1.",
          "Relationship type is allowed.",
          "Reverse edge exists or is created in the same transaction."
        ]
      },
      {
        "id": "LAW-005",
        "domain": "grounded-intelligence",
        "intent": "Single-vector answers are forbidden.",
        "principle": "Multi-Agent Triangulation",
        "enforcement": "High-stakes queries require consensus from at least three distinct retrieval or reasoning shards.",
        "severity": "MUST",
        "test": "Classify a query as high stakes and assert response is blocked when N is less than 3.",
        "owner": "CSE Consensus Engine",
        "dependencies": [
          "agent_triangulation.rego"
        ],
        "validation_criteria": [
          "High-stakes classifier runs.",
          "Shard identities are distinct.",
          "Consensus score is recorded."
        ]
      },
      {
        "id": "LAW-006",
        "domain": "grounded-intelligence",
        "intent": "The System does not guess; it synthesizes.",
        "principle": "RAG Strict Grounding",
        "enforcement": "Generation is halted when retrieved context cosine similarity is below 0.85.",
        "severity": "MUST",
        "test": "Provide low-similarity retrieval context and assert CMD: Request Clarification is returned.",
        "owner": "Retrieval Layer",
        "dependencies": [
          "GUCA Command Registry semver pin: CMD.RequestClarification@^1.0.0",
          "grounding_threshold.rego"
        ],
        "validation_criteria": [
          "Similarity score is computed.",
          "Threshold is configurable but defaults to 0.85.",
          "Fallback path avoids unsupported generation.",
          "Referenced command dependency is version-pinned and checked for compatibility."
        ]
      },
      {
        "id": "LAW-007",
        "domain": "policy-and-access",
        "intent": "Form is the vessel of Truth.",
        "principle": "Strict Schema Validation",
        "enforcement": "Artifacts must pass canonical schema validation and strict type checks before acceptance.",
        "severity": "MUST",
        "test": "Submit malformed artifact metadata and assert schema_enforcement rejects it.",
        "owner": "Schema Steward",
        "dependencies": [
          "AOP-PGPS-001",
          "schema_enforcement.rego"
        ],
        "validation_criteria": [
          "Required metadata fields exist.",
          "Enums use canonical values.",
          "Compiler or linter fails on type errors."
        ]
      },
      {
        "id": "LAW-008",
        "domain": "evolution-and-operations",
        "intent": "Stagnation is Dissonance.",
        "principle": "AST Auto-Refactoring",
        "enforcement": "Scheduled analysis detects dead code, deprecated protocol references, and unused variables.",
        "severity": "SHOULD",
        "test": "Seed deprecated references and assert an automated remediation proposal is opened.",
        "owner": "Evolution Agent",
        "dependencies": [
          "AOP-PERPETUAL-COHERENCE-001",
          "evolution_cadence.rego"
        ],
        "validation_criteria": [
          "AST scan runs on schedule.",
          "Findings are non-destructive proposals.",
          "Human review is required before merge."
        ]
      },
      {
        "id": "LAW-009",
        "domain": "evolution-and-operations",
        "intent": "Signal over Noise; high-density operational states.",
        "principle": "CQRS Segregation",